{
  "dataset_name": "GenerativeAI4Finance synthetic EDD cases",
  "dataset_version": "1.0.0",
  "seed": 20261022,
  "synthetic": true,
  "generator": "generate_dataset.py",
  "case_count": 10,
  "cases": [
    {
      "case_record": {
        "case_id": "G4F-EDD-401",
        "subject_type": "company",
        "jurisdiction": "SG",
        "review_date": "2026-10-22",
        "risk_categories": [],
        "source_records": [
          {
            "source_id": "SRC-SYN-001-01",
            "source_type": "registry",
            "description": "SYNTHETIC FIXTURE: fictional entity register extract",
            "checked_date": "2026-10-02",
            "url": "https://example.org/synthetic-edd/001/source-01"
          },
          {
            "source_id": "SRC-SYN-001-02",
            "source_type": "internal_record",
            "description": "SYNTHETIC FIXTURE: fictional onboarding declaration showing a 60/40 ownership split",
            "checked_date": "2026-10-02"
          }
        ],
        "findings": [],
        "confidence": 0.91,
        "analyst_notes": "SYNTHETIC TRAINING FIXTURE; scenario=normal; no real entity, person, source, or allegation is represented.",
        "review_status": "completed"
      },
      "scenario": "normal",
      "subject_entity": {
        "entity_id": "ENT-SYN-001",
        "synthetic_name": "Synthetic Meridian Entity 001",
        "entity_type": "company",
        "registration_id": "SYN-REG-000001",
        "registration_jurisdiction": "SG",
        "incorporation_date": "2021-02-15",
        "status": "active",
        "addresses": [
          {
            "address_id": "ADDR-SYN-001-01",
            "address_line": "2 Fictional Example Road, Sample District",
            "jurisdiction": "SG",
            "synthetic": true
          }
        ],
        "synthetic": true
      },
      "directors": [
        {
          "person_id": "PER-SYN-001-01",
          "synthetic_name": "Synthetic Person 001-A",
          "roles": [
            "director"
          ],
          "jurisdiction": "SG",
          "synthetic": true
        },
        {
          "person_id": "PER-SYN-001-02",
          "synthetic_name": "Synthetic Person 001-B",
          "roles": [
            "director",
            "shareholder"
          ],
          "jurisdiction": "SG",
          "synthetic": true
        }
      ],
      "shareholders": [
        {
          "owner_id": "PER-SYN-001-02",
          "owner_type": "individual",
          "ownership_percent": 60
        },
        {
          "owner_id": "PER-SYN-001-01",
          "owner_type": "individual",
          "ownership_percent": 40
        }
      ],
      "subsidiaries": [
        {
          "entity_id": "SUB-SYN-001-01",
          "synthetic_name": "Synthetic Meridian Subsidiary 001",
          "jurisdiction": "US",
          "ownership_percent": 100,
          "synthetic": true
        }
      ],
      "source_records": [
        {
          "source_id": "SRC-SYN-001-01",
          "source_type": "registry",
          "description": "SYNTHETIC FIXTURE: fictional entity register extract",
          "checked_date": "2026-10-02",
          "url": "https://example.org/synthetic-edd/001/source-01",
          "title": "SYNTHETIC FIXTURE: fictional entity register extract",
          "publisher": "Synthetic EDD Dataset Generator",
          "reference": "https://example.org/synthetic-edd/001/source-01",
          "publication_date": null,
          "access_date": "2026-10-02",
          "jurisdiction": "SG",
          "evidence_status": "available",
          "excerpt_or_summary": "SYNTHETIC FIXTURE: fictional entity register extract",
          "provenance_notes": "Generated fixture only; placeholder reference, not a real citation."
        },
        {
          "source_id": "SRC-SYN-001-02",
          "source_type": "internal_record",
          "description": "SYNTHETIC FIXTURE: fictional onboarding declaration showing a 60/40 ownership split",
          "checked_date": "2026-10-02",
          "title": "SYNTHETIC FIXTURE: fictional onboarding declaration showing a 60/40 ownership split",
          "publisher": "Synthetic EDD Dataset Generator",
          "reference": null,
          "publication_date": null,
          "access_date": "2026-10-02",
          "jurisdiction": "SG",
          "evidence_status": "available",
          "excerpt_or_summary": "SYNTHETIC FIXTURE: fictional onboarding declaration showing a 60/40 ownership split",
          "provenance_notes": "Generated fixture only; placeholder reference, not a real citation."
        }
      ],
      "risk_indicators": [],
      "synthetic": true
    },
    {
      "case_record": {
        "case_id": "G4F-EDD-402",
        "subject_type": "company",
        "jurisdiction": "SG",
        "review_date": "2026-10-22",
        "risk_categories": [],
        "source_records": [
          {
            "source_id": "SRC-SYN-002-01",
            "source_type": "registry",
            "description": "SYNTHETIC FIXTURE: fictional entity register extract",
            "checked_date": "2026-10-03",
            "url": "https://example.org/synthetic-edd/002/source-01"
          },
          {
            "source_id": "SRC-SYN-002-02",
            "source_type": "internal_record",
            "description": "SYNTHETIC FIXTURE: fictional onboarding declaration showing a 60/40 ownership split",
            "checked_date": "2026-10-03"
          }
        ],
        "findings": [],
        "confidence": 0.91,
        "analyst_notes": "SYNTHETIC TRAINING FIXTURE; scenario=normal; no real entity, person, source, or allegation is represented.",
        "review_status": "completed"
      },
      "scenario": "normal",
      "subject_entity": {
        "entity_id": "ENT-SYN-002",
        "synthetic_name": "Synthetic Meridian Entity 002",
        "entity_type": "company",
        "registration_id": "SYN-REG-000002",
        "registration_jurisdiction": "SG",
        "incorporation_date": "2022-03-15",
        "status": "active",
        "addresses": [
          {
            "address_id": "ADDR-SYN-002-01",
            "address_line": "3 Fictional Example Road, Sample District",
            "jurisdiction": "SG",
            "synthetic": true
          }
        ],
        "synthetic": true
      },
      "directors": [
        {
          "person_id": "PER-SYN-002-01",
          "synthetic_name": "Synthetic Person 002-A",
          "roles": [
            "director"
          ],
          "jurisdiction": "SG",
          "synthetic": true
        },
        {
          "person_id": "PER-SYN-002-02",
          "synthetic_name": "Synthetic Person 002-B",
          "roles": [
            "director",
            "shareholder"
          ],
          "jurisdiction": "SG",
          "synthetic": true
        }
      ],
      "shareholders": [
        {
          "owner_id": "PER-SYN-002-02",
          "owner_type": "individual",
          "ownership_percent": 60
        },
        {
          "owner_id": "PER-SYN-002-01",
          "owner_type": "individual",
          "ownership_percent": 40
        }
      ],
      "subsidiaries": [
        {
          "entity_id": "SUB-SYN-002-01",
          "synthetic_name": "Synthetic Meridian Subsidiary 002",
          "jurisdiction": "CA",
          "ownership_percent": 100,
          "synthetic": true
        }
      ],
      "source_records": [
        {
          "source_id": "SRC-SYN-002-01",
          "source_type": "registry",
          "description": "SYNTHETIC FIXTURE: fictional entity register extract",
          "checked_date": "2026-10-03",
          "url": "https://example.org/synthetic-edd/002/source-01",
          "title": "SYNTHETIC FIXTURE: fictional entity register extract",
          "publisher": "Synthetic EDD Dataset Generator",
          "reference": "https://example.org/synthetic-edd/002/source-01",
          "publication_date": null,
          "access_date": "2026-10-03",
          "jurisdiction": "SG",
          "evidence_status": "available",
          "excerpt_or_summary": "SYNTHETIC FIXTURE: fictional entity register extract",
          "provenance_notes": "Generated fixture only; placeholder reference, not a real citation."
        },
        {
          "source_id": "SRC-SYN-002-02",
          "source_type": "internal_record",
          "description": "SYNTHETIC FIXTURE: fictional onboarding declaration showing a 60/40 ownership split",
          "checked_date": "2026-10-03",
          "title": "SYNTHETIC FIXTURE: fictional onboarding declaration showing a 60/40 ownership split",
          "publisher": "Synthetic EDD Dataset Generator",
          "reference": null,
          "publication_date": null,
          "access_date": "2026-10-03",
          "jurisdiction": "SG",
          "evidence_status": "available",
          "excerpt_or_summary": "SYNTHETIC FIXTURE: fictional onboarding declaration showing a 60/40 ownership split",
          "provenance_notes": "Generated fixture only; placeholder reference, not a real citation."
        }
      ],
      "risk_indicators": [],
      "synthetic": true
    },
    {
      "case_record": {
        "case_id": "G4F-EDD-403",
        "subject_type": "company",
        "jurisdiction": "GB",
        "review_date": "2026-10-22",
        "risk_categories": [
          "identity_verification"
        ],
        "source_records": [
          {
            "source_id": "SRC-SYN-003-01",
            "source_type": "registry",
            "description": "SYNTHETIC FIXTURE: fictional entity register extract",
            "checked_date": "2026-10-04",
            "url": "https://example.org/synthetic-edd/003/source-01"
          },
          {
            "source_id": "SRC-SYN-003-02",
            "source_type": "internal_record",
            "description": "SYNTHETIC FIXTURE: fictional onboarding declaration showing a 60/40 ownership split",
            "checked_date": "2026-10-04"
          }